{
  "id": "sc-CA-san-diego-deposit",
  "venue_id": "ca-small-claims",
  "venue_type": "small_claims",
  "wedge": "deposit",
  "jurisdiction": "CA",
  "county": "San Diego",
  "venue_name": "San Diego County Superior Court — Small Claims Division",
  "venue_address": { "street": "330 West Broadway", "city": "San Diego", "state": "CA", "zip": "92101" },
  "venue_url": "https://www.sdcourt.ca.gov/sdcourt/smallclaims2",
  "monetary_limit": 12500,
  "forms": [
    { "form_id": "SC-100", "name": "Plaintiff's Claim and ORDER to Go to Small Claims Court", "official_url": "https://www.courts.ca.gov/documents/sc100.pdf", "fillable": true, "required": true, "copies_needed": 2, "description": "Primary filing form." },
    { "form_id": "SC-104", "name": "Declaration of Nonmilitary Status", "official_url": "https://www.courts.ca.gov/documents/sc104.pdf", "fillable": true, "required": true, "copies_needed": 1, "description": "Required federal declaration." }
  ],
  "attachments_order": [
    { "position": 1, "attachment_type": "claim_form", "description": "SC-100 (completed)", "required": true, "source": "form_template" },
    { "position": 2, "attachment_type": "demand_letter_copy", "description": "Demand letter", "required": true, "source": "generated" },
    { "position": 3, "attachment_type": "lease_copy", "description": "Lease", "required": true, "source": "user_upload" },
    { "position": 4, "attachment_type": "itemization", "description": "Deduction statement", "required": false, "source": "user_upload" },
    { "position": 5, "attachment_type": "photos", "description": "Photos", "required": false, "source": "user_upload" }
  ],
  "filing_instructions": {
    "method": "mixed",
    "e_filing_url": "https://www.sdcourt.ca.gov/sdcourt/smallclaims2/filingyourclaim",
    "steps": [
      { "step_number": 1, "instruction": "Complete forms SC-100 and SC-104." },
      { "step_number": 2, "instruction": "File at the San Diego Central Courthouse, 330 W. Broadway, or at a branch courthouse." },
      { "step_number": 3, "instruction": "Pay the filing fee." },
      { "step_number": 4, "instruction": "Serve the defendant at least 15 days before hearing." },
      { "step_number": 5, "instruction": "File proof of service and attend the hearing." }
    ],
    "service_of_process": { "method": "Personal service, substituted service, or certified mail", "deadline_days": 15, "proof_form": "SC-104A or POS-030" }
  },
  "fees": {
    "filing_fee": [
      { "amount_usd": 30, "condition": "Claim $1,500 or less" },
      { "amount_usd": 50, "condition": "Claim $1,501 to $5,000" },
      { "amount_usd": 75, "condition": "Claim $5,001 to $12,500" }
    ],
    "fee_waiver_available": true, "fee_waiver_form": "FW-001",
    "payment_methods": ["Cash", "Check", "Money order", "Credit/debit card"]
  },
  "statute_of_limitations": { "years": 4, "statute_ref": "Cal. Civ. Proc. Code §337" },
  "verification": { "last_verified": "2026-05-20", "verified_by": "NEEDS_SECOND_PASS_REVIEW", "primary_sources_checked": ["https://www.sdcourt.ca.gov/sdcourt/smallclaims2"], "next_review_due": "2026-08-20" }
}
